<?xml version="1.0" encoding="UTF-8"?>
<!DOCTYPE globals SYSTEM "../../../../dtd/globals.dtd">

<globals>
    <colors>
        <color name="menuback">C0FFA500</color>
        <color name="menuheader">C0111111</color>
        <color name="menuactive">F0111111</color>
<!--        <color name="menualternate">C0F5B914</color> -->
        <color name="menuseparator">22FFFFFF</color>
        <color name="fontdefault">F0111111</color>
        <color name="fontseparator">F0111111</color>
        <color name="scrollbar">F0111111</color>
        <!-- colors svg templates -->
        <color name="iconactive">FFFFFFFF</color>
        <color name="icon">F0111111</color>
        <color name="iconselected">FF800000</color>
        <color name="iconrecactive">F0FFFFFF</color>
        <color name="iconrecinactive">F0111111</color>
    </colors>

    <variables>
    </variables>

    <translations>
    </translations>

    <fonts>
    </fonts>
</globals>
